{
  "event_id": "a25824f7-a94b-4256-b89f-6f9b4e39cad6",
  "event_type": "risk.assessed",
  "schema_version": 2,
  "occurred_at": "2026-09-21T15:00:01.125000Z",
  "tenant_id": "11111111-1111-4111-8111-111111111111",
  "aggregate_type": "device_risk_stream",
  "aggregate_id": "33333333-3333-4333-8333-333333333333",
  "aggregate_version": "42",
  "correlation_id": "4d9d9d30-d209-446e-99ea-d40ab0953d0d",
  "causation_id": "0d72ff07-a646-4d41-9b5b-52c5f25e4ca8",
  "traceparent": "00-4bf92f3577b34da6a3ce929d0e0e4736-00f067aa0ba902b7-01",
  "payload": {
    "assessment_id": "ce5150ea-f44f-410d-b165-1e06a7bd2205",
    "assessment_version": "2",
    "device_id": "33333333-3333-4333-8333-333333333333",
    "reading_id": "bb70cd06-0720-461e-8ecf-a56754985f87",
    "source_event_id": "0d72ff07-a646-4d41-9b5b-52c5f25e4ca8",
    "bin_id": "55555555-5555-4555-8555-555555555555",
    "lot_id": "77777777-7777-4777-8777-777777777777",
    "grain_type": "wheat",
    "occupancy_version": "1",
    "policy_version": "1",
    "score": null,
    "severity": "insufficient_data",
    "alert_eligible": false,
    "reasons": ["policy_not_calibrated"],
    "policy_id": "88888888-8888-4888-8888-888888888888",
    "policy_calibrated": false,
    "policy_provenance": {"source": "synthetic_fixture", "status": "draft"}
  }
}
